{
  "$schema": "./opcodes.schema.json",
  "schema_version": 1,
  "capture_snapshot": {
    "date": "2026-10-10",
    "client_revisions": [3526, 3527],
    "sessions": 6,
    "total_frames": 172178,
    "rc4_body_bytes": 1950077,
    "client_time_frames": 159676
  },
  "confidence_levels": {
    "locally-confirmed": "Reproduced locally across independent sessions or verified byte-for-byte against runtime code.",
    "publicly-confirmed": "Implemented by at least two independent public parsers.",
    "parser-based": "Present in a public parser but not yet validated field-by-field locally.",
    "inferred": "Strong structural evidence exists, but the application meaning still needs a controlled test.",
    "observed": "The opcode and shape are reproducibly visible after decryption; semantics are open.",
    "hypothesis": "A candidate interpretation that requires another experiment."
  },
  "opcodes": [
    {
      "wire": "0139",
      "phase": "lobby",
      "directions": ["S2C"],
      "name": "LOBBY_HANDSHAKE",
      "encryption": "clear",
      "confidence": "parser-based",
      "body_lengths": [],
      "notes": "Lobby handshake in public parsers.",
      "fields": []
    },
    {
      "wire": "0339",
      "phase": "lobby",
      "directions": ["S2C"],
      "name": "LOBBY_PING",
      "encryption": "clear",
      "confidence": "parser-based",
      "body_lengths": [],
      "notes": "Lobby ping in public parsers.",
      "fields": []
    },
    {
      "wire": "0639",
      "phase": "lobby",
      "directions": ["S2C"],
      "name": "LOBBY_ACCOUNT",
      "encryption": "clear",
      "confidence": "parser-based",
      "body_lengths": [],
      "notes": "Account-related lobby response.",
      "fields": []
    },
    {
      "wire": "0939",
      "phase": "lobby",
      "directions": ["S2C"],
      "name": "LOBBY_SERVER_LIST",
      "encryption": "clear",
      "confidence": "parser-based",
      "body_lengths": [],
      "notes": "Server-list response in public parsers.",
      "fields": []
    },
    {
      "wire": "0B39",
      "phase": "lobby",
      "directions": ["S2C"],
      "name": "LOBBY_CHARACTER_LIST",
      "encryption": "clear",
      "confidence": "parser-based",
      "body_lengths": [],
      "notes": "Character-list response in public parsers.",
      "fields": []
    },
    {
      "wire": "0D39",
      "phase": "lobby",
      "directions": ["S2C"],
      "name": "LOBBY_JOIN",
      "encryption": "clear",
      "confidence": "parser-based",
      "body_lengths": [],
      "notes": "Lobby join response in public parsers.",
      "fields": []
    },
    {
      "wire": "0F39",
      "phase": "lobby",
      "directions": ["S2C"],
      "name": "LOBBY_WORLD_REDIRECT",
      "encryption": "clear",
      "confidence": "publicly-confirmed",
      "body_lengths": [],
      "notes": "Contains at least server ID, host, and port.",
      "fields": []
    },
    {
      "wire": "0036",
      "phase": "world",
      "directions": ["S2C"],
      "name": "SERVER_TICK",
      "encryption": "clear",
      "confidence": "locally-confirmed",
      "body_lengths": [10],
      "notes": "Regular server timestamp packet.",
      "fields": [
        {"offset": 0, "type": "bytes[2]", "name": "opcode", "status": "confirmed"},
        {"offset": 2, "type": "u64le", "name": "unix_ms", "status": "confirmed"}
      ]
    },
    {
      "wire": "0136",
      "phase": "world",
      "directions": ["C2S"],
      "name": "CLIENT_TIME",
      "encryption": "rc4",
      "confidence": "locally-confirmed",
      "body_lengths": [10],
      "notes": "A newly sampled client timestamp, not an exact echo of the preceding server tick.",
      "fields": [
        {"offset": 0, "type": "bytes[2]", "name": "opcode", "status": "confirmed"},
        {"offset": 2, "type": "u64le", "name": "unix_ms", "status": "confirmed"}
      ]
    },
    {
      "wire": "0236",
      "phase": "world",
      "directions": ["C2S"],
      "name": "CLIENT_PERIODIC_TELEMETRY",
      "encryption": "rc4",
      "confidence": "hypothesis",
      "body_lengths": [11],
      "notes": "The first three consecutive retained samples increase the u64 value by exactly 10,000 each time, consistent with a ten-second monotonic-millisecond report. The value is not a Unix timestamp and the final byte varies.",
      "fields": [
        {"offset": 0, "type": "bytes[2]", "name": "opcode", "status": "confirmed"},
        {"offset": 2, "type": "u64le", "name": "monotonic_time_ms", "status": "inferred; exact +10000 steps in consecutive retained samples"},
        {"offset": 10, "type": "u8", "name": "telemetry_value", "status": "unknown; variable in retained samples"}
      ]
    },
    {
      "wire": "5136",
      "phase": "world",
      "directions": ["C2S"],
      "name": "CLIENT_STARTUP_FLOAT_51",
      "encryption": "rc4",
      "confidence": "observed",
      "body_lengths": [6],
      "notes": "A live world-entry validation emitted five samples at approximately one-second intervals with float values 2000, 2500, 3000, 3500, and 3800. The field layout is confirmed; its application meaning remains open.",
      "fields": [
        {"offset": 0, "type": "bytes[2]", "name": "opcode", "status": "confirmed"},
        {"offset": 2, "type": "f32le", "name": "startup_value", "status": "confirmed structure; semantics unknown"}
      ]
    },
    {
      "wire": "0336",
      "phase": "world",
      "directions": ["S2C"],
      "name": "WORLD_PING",
      "encryption": "clear",
      "confidence": "parser-based",
      "body_lengths": [],
      "notes": "Listed as ping by public parsers; distinct from confirmed C2S CLIENT_TIME.",
      "fields": []
    },
    {
      "wire": "1036",
      "phase": "world",
      "directions": ["C2S"],
      "name": "CLIENT_RSA_HANDSHAKE",
      "encryption": "clear",
      "confidence": "locally-confirmed",
      "body_lengths": [283],
      "notes": "Clear packet that installs an ephemeral RSA-2048 public key with exponent 3.",
      "fields": [
        {"offset": 0, "type": "bytes[2]", "name": "opcode", "status": "confirmed"},
        {"offset": 2, "type": "uvarint", "name": "rsa_der_length", "status": "confirmed"},
        {"offset": "2+uvarint_width", "type": "bytes[rsa_der_length]", "name": "rsa_public_key_pkcs1_der", "status": "confirmed"},
        {"offset": "after rsa_public_key", "type": "u32le", "name": "client_revision", "status": "confirmed"},
        {"offset": "after client_revision", "type": "bytes[4]", "name": "constant_04060502", "status": "confirmed"},
        {"offset": "after constant", "type": "ascii[2]", "name": "region", "status": "confirmed"},
        {"offset": "body_end-1", "type": "u8", "name": "trailing_02", "status": "confirmed"}
      ]
    },
    {
      "wire": "1136",
      "phase": "world",
      "directions": ["S2C"],
      "name": "SERVER_RSA_HANDSHAKE",
      "encryption": "clear",
      "confidence": "locally-confirmed",
      "body_lengths": [278],
      "notes": "The 256-byte block decrypts as RSA-OAEP-SHA1 and yields the complete 214-byte RC4 key.",
      "fields": [
        {"offset": 0, "type": "bytes[2]", "name": "opcode", "status": "confirmed"},
        {"offset": 2, "type": "u16le", "name": "status", "status": "confirmed"},
        {"offset": 4, "type": "u32le", "name": "timeout_ms", "status": "confirmed"},
        {"offset": 8, "type": "uvarint", "name": "rsa_ciphertext_length", "status": "confirmed"},
        {"offset": 10, "type": "bytes[256]", "name": "rsa_ciphertext", "status": "confirmed"},
        {"offset": 266, "type": "u64le", "name": "reserved", "status": "confirmed"},
        {"offset": 274, "type": "i32le", "name": "sentinel_or_result", "status": "confirmed"}
      ]
    },
    {
      "wire": "1336",
      "phase": "world",
      "directions": ["C2S"],
      "name": "CLIENT_SESSION_SETUP",
      "encryption": "rc4",
      "confidence": "inferred",
      "body_lengths": [158],
      "notes": "First encrypted body in all six decoded sessions. The byte layout and Base64 token grammar are locally confirmed. The encoded token is copied from the NC Platform SDK authn_token response field, with -authnToken: supported as an alternate input; the identifier meanings and other value sources remain open. Raw values are excluded.",
      "fields": [
        {"offset": 0, "type": "bytes[2]", "name": "opcode", "status": "confirmed"},
        {"offset": 2, "type": "uvarint", "name": "primary_identifier_length", "status": "confirmed; observed value 43"},
        {"offset": "2+uvarint_width", "type": "ascii[primary_identifier_length]", "name": "primary_identifier", "status": "confirmed structure; meaning unknown"},
        {"offset": "after primary_identifier", "type": "u8", "name": "primary_identifier_terminator", "status": "confirmed zero"},
        {"offset": "after primary terminator", "type": "uvarint", "name": "encoded_token_length", "status": "confirmed; observed value 100"},
        {"offset": "after encoded_token_length", "type": "base64-ascii[encoded_token_length]", "name": "encoded_token", "status": "confirmed; decodes to stable_identifier ':' connection_identifier NUL"},
        {"offset": "after encoded_token", "type": "u8", "name": "encoded_token_terminator", "status": "confirmed zero"},
        {"offset": "after token terminator", "type": "u8", "name": "setup_flags", "status": "confirmed bitfield: bit 0 is an unknown caller flag; bit 1 means optional_value > 0"},
        {"offset": "after setup_flags", "type": "u64le", "name": "optional_value", "status": "confirmed builder input; application meaning unknown"}
      ]
    },
    {
      "wire": "1536",
      "phase": "world",
      "directions": ["S2C"],
      "name": "LOGIN_OR_SERVER_TRANSFER",
      "encryption": "clear",
      "confidence": "inferred",
      "body_lengths": [4610],